{
  "$schema": "http://json-schema.org/draft-07/schema#",
  "$id": "https://wang-er-1.github.io/travel-routes/catalog.schema.v2.json",
  "title": "旅踪集路线清单 catalog v2.0",
  "type": "object",
  "required": ["schema_version", "generated_at", "count", "routes"],
  "additionalProperties": false,
  "properties": {
    "schema_version": { "const": "2.0" },
    "generated_at": { "type": "string",
      "pattern": "^\\d{4}-\\d{2}-\\d{2}T\\d{2}:\\d{2}:\\d{2}[+-]\\d{2}:\\d{2}$",
      "description": "清单生成时间，带时区ISO" },
    "count": { "type": "integer", "minimum": 0 },
    "routes": {
      "type": "array",
      "items": {
        "type": "object",
        "required": ["source_id", "source_type", "content_hash", "blogger",
                     "title", "data_status", "updated_at", "json_path", "page_path",
                     "destinations", "location_terms"],
        "additionalProperties": false,
        "properties": {
          "source_id": { "type": "string", "pattern": "^BV[0-9A-Za-z]+$",
            "description": "值为BV号" },
          "source_type": { "const": "bilibili_video" },
          "content_hash": { "type": "string", "pattern": "^sha256:[0-9a-f]{64}$",
            "description": "按最终JSON UTF-8文件内容计算的SHA-256" },
          "blogger": { "type": "string", "minLength": 1 },
          "series": {
            "type": ["object", "null"],
            "required": ["title", "series_id", "episode_number"],
            "additionalProperties": false,
            "properties": {
              "title": { "type": "string" },
              "series_id": { "type": "string" },
              "episode_number": { "type": ["integer", "null"] }
            }
          },
          "title": { "type": "string", "minLength": 1 },
          "regions": { "type": "array", "items": { "type": "string" },
            "description": "跨省路线可多个，如 [\"东北\"]" },
          "destinations": {
            "type": "array",
            "items": { "type": "string", "minLength": 1 },
            "uniqueItems": true,
            "description": "面向展示。每个 location 取最细且最有辨识度的非空层级(village→town→county/district→city→province→region→country)；locations 无可用值时从有序 stops[].name 取前3个不重复名称忠实兜底。如荻港村期 [\"荻港村\"]" },
          "location_terms": {
            "type": "array",
            "items": { "type": "string", "minLength": 1 },
            "uniqueItems": true,
            "description": "面向搜索/筛选。locations 中全部非空层级去重后的集合。如荻港村期 [\"浙江省\",\"湖州市\",\"南浔区\",\"和孚镇\",\"荻港村\"]；locations 为空时为 []" },
          "data_status": { "enum": ["draft", "verified"] },
          "updated_at": { "type": "string", "pattern": "^\\d{4}-\\d{2}-\\d{2}$",
            "description": "必须来自JSON的last_updated，不是视频publish_date" },
          "json_path": { "type": "string", "pattern": "^episodes/BV[0-9A-Za-z]+\\.json$" },
          "page_path": { "type": ["string", "null"], "pattern": "^pages/BV[0-9A-Za-z]+\\.html$" },
          "related_videos": {
            "type": "array",
            "description": "保留对象，后台无需再拉单条JSON即可判断上下集",
            "items": {
              "type": "object",
              "required": ["bvid", "relation"],
              "additionalProperties": false,
              "properties": {
                "bvid": { "type": "string", "pattern": "^BV[0-9A-Za-z]+$" },
                "relation": { "enum": ["part", "series"] },
                "part_number": { "type": ["integer", "null"], "minimum": 1 }
              }
            }
          }
        }
      }
    }
  }
}
