{
  "schema_version": "2.0",
  "generated_at": "2026-09-08T08:09:40+08:00",
  "count": 26,
  "routes": [
    {
      "source_id": "BV111Fze1EZw",
      "source_type": "bilibili_video",
      "content_hash": "sha256:701e181fa90abc9ceb3d79843f5c2f1457af76c9a7b8f31e8a399d6f00148672",
      "blogger": "小可追太阳",
      "series": {
        "title": "搭火车环游中国",
        "series_id": "xiaoke-train-china",
        "episode_number": 5
      },
      "title": "搭火车环游中国第5站：鞍山——鞍钢工人的6元午饭、小武康大楼、胜利广场鸽、大孤山700米深矿坑",
      "regions": [
        "东北"
      ],
      "destinations": [
        "鞍山"
      ],
      "location_terms": [
        "中国",
        "东北",
        "辽宁",
        "鞍山"
      ],
      "data_status": "draft",
      "updated_at": "2026-08-24",
      "json_path": "episodes/BV111Fze1EZw.json",
      "page_path": "pages/BV111Fze1EZw.html",
      "related_videos": []
    },
    {
      "source_id": "BV13n5RzbET8",
      "source_type": "bilibili_video",
      "content_hash": "sha256:e803cd6e71069793ffe9060c9b81e4eb57f069e67e07e05883d4df388229d185",
      "blogger": "巡游轨迹",
      "series": null,
      "title": "冈底斯山脉普拉喜琼：从日喀则到5600米车宿，徒步看冰川峡谷",
      "regions": [
        "冈底斯山脉"
      ],
      "destinations": [
        "西安市",
        "桑珠孜区",
        "昂仁县",
        "乳脚乡",
        "西藏自治区"
      ],
      "location_terms": [
        "中国",
        "陕西省",
        "西安市",
        "西藏自治区",
        "日喀则市",
        "桑珠孜区",
        "昂仁县",
        "萨嘎县",
        "乳脚乡",
        "冈底斯山脉"
      ],
      "data_status": "draft",
      "updated_at": "2026-09-03",
      "json_path": "episodes/BV13n5RzbET8.json",
      "page_path": null,
      "related_videos": []
    },
    {
      "source_id": "BV15yXGBxE9U",
      "source_type": "bilibili_video",
      "content_hash": "sha256:b4475c277951838619347830856471563c3ec6522e6140bf38252349d2a91a01",
      "blogger": "赖导AboutLai",
      "series": null,
      "title": "云南最南边境小城·勐腊自驾（3天）",
      "regions": [],
      "destinations": [
        "重庆 → 景洪 → 勐腊",
        "景兰大酒店（《边水往事》取景地）",
        "牛乐乐老挝火锅"
      ],
      "location_terms": [],
      "data_status": "draft",
      "updated_at": "2026-08-23",
      "json_path": "episodes/BV15yXGBxE9U.json",
      "page_path": "pages/BV15yXGBxE9U.html",
      "related_videos": []
    },
    {
      "source_id": "BV16NpQznEXC",
      "source_type": "bilibili_video",
      "content_hash": "sha256:06bc1121b362c5170d4fecb351105f093322a7f0896feb091721b1d69a85b1bc",
      "blogger": "赖导AboutLai",
      "series": null,
      "title": "一个人自驾河西走廊·武威+张掖（2天）",
      "regions": [],
      "destinations": [
        "兰州 → 乌鞘岭",
        "天梯山石窟",
        "武威（河西四郡第一城）"
      ],
      "location_terms": [],
      "data_status": "draft",
      "updated_at": "2026-08-19",
      "json_path": "episodes/BV16NpQznEXC.json",
      "page_path": "pages/BV16NpQznEXC.html",
      "related_videos": []
    },
    {
      "source_id": "BV17nuzzyE8a",
      "source_type": "bilibili_video",
      "content_hash": "sha256:9ad01bc8736f4c8e0fa354ab21d553cfae4e276af8539a8ad44610d075cee36b",
      "blogger": "小鹿Lawrence",
      "series": {
        "title": "清单人生",
        "series_id": "xiaolu-qingdan-rensheng",
        "episode_number": null
      },
      "title": "内蒙古呼伦贝尔·一日牧民体验——剪羊毛/挤奶/蒙古包/团结肉，草原生活的真实重量",
      "regions": [
        "东北"
      ],
      "destinations": [
        "根河市"
      ],
      "location_terms": [
        "中国",
        "东北",
        "内蒙古自治区",
        "呼伦贝尔市",
        "根河市"
      ],
      "data_status": "draft",
      "updated_at": "2026-08-27",
      "json_path": "episodes/BV17nuzzyE8a.json",
      "page_path": "pages/BV17nuzzyE8a.html",
      "related_videos": []
    },
    {
      "source_id": "BV19PGwzrEvW",
      "source_type": "bilibili_video",
      "content_hash": "sha256:5e55808046fad1dd5abf2927d89184b7177fa3e75163f0cbbcae92ee13d410c8",
      "blogger": "赖导AboutLai",
      "series": null,
      "title": "从漠河穿越大兴安岭去呼伦贝尔（夏至独行）",
      "regions": [],
      "destinations": [
        "漠河县城",
        "满归镇",
        "根河市"
      ],
      "location_terms": [],
      "data_status": "draft",
      "updated_at": "2026-08-18",
      "json_path": "episodes/BV19PGwzrEvW.json",
      "page_path": "pages/BV19PGwzrEvW.html",
      "related_videos": []
    },
    {
      "source_id": "BV19jfPY9Eot",
      "source_type": "bilibili_video",
      "content_hash": "sha256:0cd56ea9a7cb3c346f4707659e3d68f99246500cd2ab38ced9704337dc55c949",
      "blogger": "赖导AboutLai",
      "series": null,
      "title": "玉门老市区·资源枯竭小城探访（4天）",
      "regions": [],
      "destinations": [
        "上海 → 嘉峪关 → 老市区",
        "浩宇大酒店",
        "解放门/大环岛市中心"
      ],
      "location_terms": [],
      "data_status": "draft",
      "updated_at": "2026-08-23",
      "json_path": "episodes/BV19jfPY9Eot.json",
      "page_path": "pages/BV19jfPY9Eot.html",
      "related_videos": []
    },
    {
      "source_id": "BV19vzvBXEYb",
      "source_type": "bilibili_video",
      "content_hash": "sha256:1a7412f8d8383c6a68cdb9c61ebb453df642165d61b63afb8f34c1105e12e317",
      "blogger": "小可追太阳",
      "series": null,
      "title": "搭火车环游中国·第33站：满洲里（上/下两集，中俄蒙边境百年商埠）",
      "regions": [],
      "destinations": [
        "海拉尔站 → 满洲里（火车）",
        "满洲里火车站周边老建筑",
        "沙俄监狱旧址"
      ],
      "location_terms": [],
      "data_status": "draft",
      "updated_at": "2026-08-19",
      "json_path": "episodes/BV19vzvBXEYb.json",
      "page_path": "pages/BV19vzvBXEYb.html",
      "related_videos": [
        {
          "bvid": "BV1bicgzaEQp",
          "relation": "part",
          "part_number": 2
        }
      ]
    },
    {
      "source_id": "BV1F9U8BzE3F",
      "source_type": "bilibili_video",
      "content_hash": "sha256:cf152935ca58bba7a08ee4c54586f218c1c41951cd877d87f372aa9d715737b1",
      "blogger": "赖导AboutLai",
      "series": null,
      "title": "坐水上公交游长江三峡（上/下两集）",
      "regions": [],
      "destinations": [
        "奉节县",
        "巫山县",
        "青石村"
      ],
      "location_terms": [],
      "data_status": "draft",
      "updated_at": "2026-08-18",
      "json_path": "episodes/BV1F9U8BzE3F.json",
      "page_path": "pages/BV1F9U8BzE3F.html",
      "related_videos": [
        {
          "bvid": "BV1TwS7BmETP",
          "relation": "part",
          "part_number": 2
        }
      ]
    },
    {
      "source_id": "BV1Ghjnz6EdN",
      "source_type": "bilibili_video",
      "content_hash": "sha256:116d075025689a48203d5563e02591cf0e6525a6c39d2e78cdccddc213cdd5c2",
      "blogger": "小可追太阳",
      "series": {
        "title": "搭火车环游中国",
        "series_id": "4542924",
        "episode_number": 17
      },
      "title": "一面坡·百年俄式小镇+全球90%套娃产地（2天）",
      "regions": [],
      "destinations": [
        "哈尔滨火车站",
        "绿皮火车·中东铁路滨绥线",
        "一面坡火车站"
      ],
      "location_terms": [],
      "data_status": "draft",
      "updated_at": "2026-08-26",
      "json_path": "episodes/BV1Ghjnz6EdN.json",
      "page_path": "pages/BV1Ghjnz6EdN.html",
      "related_videos": [
        {
          "bvid": "BV1HHEqzBEM1",
          "relation": "series"
        },
        {
          "bvid": "BV1cA7azpEVm",
          "relation": "series"
        }
      ]
    },
    {
      "source_id": "BV1Hj1jYKECK",
      "source_type": "bilibili_video",
      "content_hash": "sha256:c68c234cbddcb8190239bdb39e38b82c19fe007d928cbe94a435dfd754fe728e",
      "blogger": "赖导AboutLai",
      "series": null,
      "title": "云南复古小城·个旧旅行（3天）",
      "regions": [],
      "destinations": [
        "昆明 → 个旧",
        "红河大酒店",
        "金湖（环湖+巴金广场）"
      ],
      "location_terms": [],
      "data_status": "draft",
      "updated_at": "2026-08-23",
      "json_path": "episodes/BV1Hj1jYKECK.json",
      "page_path": "pages/BV1Hj1jYKECK.html",
      "related_videos": []
    },
    {
      "source_id": "BV1KdHZz2ETB",
      "source_type": "bilibili_video",
      "content_hash": "sha256:1310fbc8f5f9a95d67fe90580031f00a10f81f79e63a4648d87140bf2337da72",
      "blogger": "小V的奇幻旅程",
      "series": null,
      "title": "青甘大环线上半程·敦煌→青海湖（莫高窟→鸣沙山月牙泉→黑独山→火星一号公路→察尔汗盐湖→茶卡→青海湖→西宁）",
      "regions": [
        "西北"
      ],
      "destinations": [
        "敦煌市",
        "冷湖镇",
        "格尔木市",
        "德令哈市",
        "乌兰县",
        "共和县"
      ],
      "location_terms": [
        "中国",
        "西北",
        "甘肃省",
        "酒泉市",
        "敦煌市",
        "青海省",
        "海西蒙古族藏族自治州",
        "茫崖市",
        "冷湖镇",
        "格尔木市",
        "德令哈市",
        "乌兰县",
        "海南藏族自治州",
        "共和县"
      ],
      "data_status": "draft",
      "updated_at": "2026-08-26",
      "json_path": "episodes/BV1KdHZz2ETB.json",
      "page_path": "pages/BV1KdHZz2ETB.html",
      "related_videos": [
        {
          "bvid": "BV1qVspzuEfk",
          "relation": "part",
          "part_number": 2
        }
      ]
    },
    {
      "source_id": "BV1RovaBTEE4",
      "source_type": "bilibili_video",
      "content_hash": "sha256:0cf98e8282abd4167feb4c1f67d182b91b859acee06d76bcffb567a068c92de2",
      "blogger": "期末77",
      "series": null,
      "title": "世界十大徒步路线·虎跳峡高路20公里（玉龙雪山与哈巴雪山之间）",
      "regions": [
        "西南"
      ],
      "destinations": [
        "虎跳峡镇"
      ],
      "location_terms": [
        "中国",
        "西南",
        "云南省",
        "迪庆藏族自治州",
        "香格里拉市",
        "虎跳峡镇"
      ],
      "data_status": "draft",
      "updated_at": "2026-09-06",
      "json_path": "episodes/BV1RovaBTEE4.json",
      "page_path": "pages/BV1RovaBTEE4.html",
      "related_videos": []
    },
    {
      "source_id": "BV1UJ4m1M7vd",
      "source_type": "bilibili_video",
      "content_hash": "sha256:1b6fa9ee07e117d51cd42ab9856a48fab201f7246fe506363506be9f01e2cdd5",
      "blogger": "赖导AboutLai",
      "series": null,
      "title": "山东最北海岛·北隍城岛慢旅行（3天）",
      "regions": [],
      "destinations": [
        "蓬莱（出发港）",
        "巡仙十二号客船",
        "北隍城岛·渔家乐"
      ],
      "location_terms": [],
      "data_status": "draft",
      "updated_at": "2026-08-23",